{
 "version": 1,
 "generated_at": "2026-10-28",
 "source": "docs/ModernDocs/client-zero/ontology/edit-sources.yaml",
 "items": [
  {
   "kind": "type",
   "id": "Account",
   "editable": true,
   "source": "docs/ModernDocs/client-zero/sales/customers.yaml, sales/pipeline.yaml",
   "key_path": "accounts[] (key ACC-NNNN; roles only, never names)",
   "format": "node keyed by the `key` fact",
   "allowed_values": [
    "^ACC-[a-z0-9-]+$"
   ]
  },
  {
   "kind": "type",
   "id": "AlloyCheck",
   "editable": false,
   "source": "knovas-software/models/alloy/ci/expected_results.json",
   "key_path": "checks[] (file, command)",
   "reason": "from CI",
   "fix_at": "the Alloy model and its CI run (alloy-merge writes the lockfile); the component mapping is alloy_models in docs/ModernDocs/alloy/component-manifest.yaml",
   "format": "node keyed by the `key` fact",
   "allowed_values": [
    "^ALLOY-.+#.+$"
   ]
  },
  {
   "kind": "type",
   "id": "ApiServiceGroup",
   "editable": true,
   "source": "docs/ModernDocs/client-zero/ontology/seed.yaml",
   "key_path": "nodes[type=ApiServiceGroup]",
   "format": "node keyed by the `key` fact",
   "allowed_values": [
    "^API-[A-Z-]+$"
   ]
  },
  {
   "kind": "type",
   "id": "BoundedContext",
   "editable": true,
   "source": "docs/ModernDocs/client-zero/ontology/seed.yaml",
   "key_path": "nodes[type=BoundedContext] (L1-*)",
   "format": "node keyed by the `key` fact",
   "allowed_values": [
    "^L1-[A-Z]+$"
   ]
  },
  {
   "kind": "type",
   "id": "Campaign",
   "editable": true,
   "source": "docs/ModernDocs/client-zero/marketing/campaigns.yaml",
   "key_path": "campaigns[] (key CMP-…)",
   "format": "node keyed by the `key` fact",
   "allowed_values": [
    "^CMP-[a-z0-9-]+$"
   ]
  },
  {
   "kind": "type",
   "id": "Capability",
   "editable": true,
   "source": "docs/ModernDocs/client-zero/ontology/seed.yaml",
   "key_path": "nodes[type=Capability] (CAP-NN)",
   "format": "node keyed by the `key` fact",
   "allowed_values": [
    "^CAP-\\d{2}$"
   ]
  },
  {
   "kind": "type",
   "id": "Commit",
   "editable": false,
   "source": "git log",
   "key_path": "COMMIT-<12 hex>",
   "reason": "from git",
   "fix_at": "the commit message or PR branch names the plan (FEAT-… or its slug)",
   "format": "node keyed by the `key` fact",
   "allowed_values": [
    "^COMMIT-[0-9a-f]{7,40}$"
   ]
  },
  {
   "kind": "type",
   "id": "Company",
   "editable": true,
   "source": "docs/ModernDocs/client-zero/ontology/seed.yaml",
   "key_path": "nodes[type=Company]",
   "format": "node keyed by the `key` fact",
   "allowed_values": [
    "^COMP-[a-z0-9-]+$"
   ]
  },
  {
   "kind": "type",
   "id": "Component",
   "editable": true,
   "source": "docs/ModernDocs/alloy/component-manifest.yaml (L2); components/L1-*/<l2>/spec.ai.yaml children (L3)",
   "key_path": "components.<L2-…>; children[].id (L3-…)",
   "format": "node keyed by the `key` fact",
   "allowed_values": [
    "^L2-[A-Z0-9-]+$",
    "^L3-[A-Z0-9-]+$"
   ]
  },
  {
   "kind": "type",
   "id": "ComponentContract",
   "editable": true,
   "source": "docs/ModernDocs/components/L1-*/<l2>/spec.ai.yaml",
   "key_path": "preconditions[] / postconditions[] / responsibilities[] (id)",
   "format": "node keyed by the `key` fact",
   "allowed_values": [
    "^(PRE|POST|RESP)-\\d+$",
    "^L2-[A-Z0-9-]+/(PRE|POST|RESP)-[A-Z0-9-]+$"
   ]
  },
  {
   "kind": "type",
   "id": "Customer",
   "editable": true,
   "source": "docs/ModernDocs/client-zero/sales/customers.yaml",
   "key_path": "customers[]",
   "format": "node keyed by the `key` fact",
   "allowed_values": [
    "^CUST-[a-z0-9-]+$"
   ]
  },
  {
   "kind": "type",
   "id": "Decision",
   "editable": true,
   "source": "client-zero/ontology/decisions/DEC-*.md; docs/Docs ADRs; plan tables D-/OD- rows; spec.ai.yaml design_decisions[]; marketing evaluations",
   "key_path": "front matter (DEC, ADR) or the table row",
   "format": "node keyed by the `key` fact",
   "allowed_values": [
    "^DEC-\\d{4}$",
    "^ADR-\\d{4}$",
    "^FEAT-\\d{4}-\\d{2}-\\d{2}-[a-z0-9-]+/(D|OD)-[A-Z]*-?\\d+$",
    "^L2-[A-Z0-9-]+/D[A-Z]*-\\d+$",
    "^CMP-[a-z0-9-]+/D-\\d+$"
   ]
  },
  {
   "kind": "type",
   "id": "EvidenceRecord",
   "editable": false,
   "source": "docs/ModernDocs/client-zero/marketing/evaluations/*.yaml",
   "key_path": "evidence",
   "reason": "written by script",
   "fix_at": "campaign_eval.py writes it from the results; a founder corrects the evaluation file",
   "format": "node keyed by the `key` fact",
   "allowed_values": [
    "^EV-\\d{4}$",
    "^EV-cmp-[a-z0-9-]+$"
   ]
  },
  {
   "kind": "type",
   "id": "Experiment",
   "editable": true,
   "source": "docs/ModernDocs/client-zero/ontology/experiments.yaml",
   "key_path": "nodes[type=Experiment]",
   "format": "node keyed by the `key` fact",
   "allowed_values": [
    "^EXP-[a-z0-9-]+$"
   ]
  },
  {
   "kind": "type",
   "id": "FeaturePlan",
   "editable": true,
   "source": "docs/ModernDocs/plans/<date>-<slug>.md",
   "key_path": "the file (key FEAT-<date>-<slug>)",
   "format": "node keyed by the `key` fact",
   "allowed_values": [
    "^FEAT-\\d{4}-\\d{2}-\\d{2}-[a-z0-9-]+$"
   ]
  },
  {
   "kind": "type",
   "id": "Function",
   "editable": true,
   "source": "docs/ModernDocs/client-zero/ontology/seed.yaml",
   "key_path": "nodes[type=Function]",
   "format": "node keyed by the `key` fact",
   "allowed_values": [
    "^FN-[A-Z]+$"
   ]
  },
  {
   "kind": "type",
   "id": "Goal",
   "editable": true,
   "source": "docs/ModernDocs/client-zero/ontology/goals.yaml",
   "key_path": "nodes[type=Goal]",
   "format": "node keyed by the `key` fact",
   "allowed_values": [
    "^GOAL-\\d{4}-(Q[1-4]|\\d{2})-[a-z0-9-]+$"
   ]
  },
  {
   "kind": "type",
   "id": "Hypothesis",
   "editable": true,
   "source": "docs/ModernDocs/client-zero/inputs/market/Knovas-Hypothesis-Register.xlsx",
   "key_path": "sheet Hypotheses, columns Subject + No.",
   "format": "node keyed by the `key` fact",
   "allowed_values": [
    "^(ICP|P)-\\d{2}\\.H\\d{2}$",
    "^H-[A-Z0-9-]+$"
   ]
  },
  {
   "kind": "type",
   "id": "Invariant",
   "editable": true,
   "source": "docs/ModernDocs/golden_invariants/GI-*.md",
   "key_path": "front matter id or the file stem",
   "format": "node keyed by the `key` fact",
   "allowed_values": [
    "^GI-[A-Z0-9]+(-[A-Z0-9]+)*-\\d+$"
   ]
  },
  {
   "kind": "type",
   "id": "Metric",
   "editable": true,
   "source": "docs/ModernDocs/client-zero/ontology/metrics.yaml",
   "key_path": "metrics[]",
   "format": "node keyed by the `key` fact",
   "allowed_values": [
    "^MET-[a-z0-9-]+$"
   ]
  },
  {
   "kind": "type",
   "id": "MetricSample",
   "editable": false,
   "source": "docs/ModernDocs/client-zero/ontology/metric-samples/*.yaml; marketing/results/*.csv",
   "key_path": "samples[]; rows",
   "reason": "written by script",
   "fix_at": "knowledge_health.py (metrics) or the campaign results CSV",
   "format": "node keyed by the `key` fact",
   "allowed_values": [
    "^SAMPLE-[a-z0-9-]+-\\d{4}-\\d{2}-\\d{2}$"
   ]
  },
  {
   "kind": "type",
   "id": "Opportunity",
   "editable": true,
   "source": "docs/ModernDocs/client-zero/sales/pipeline.yaml",
   "key_path": "opportunities[]",
   "format": "node keyed by the `key` fact",
   "allowed_values": [
    "^OPP-[a-z0-9-]+$"
   ]
  },
  {
   "kind": "type",
   "id": "Person",
   "editable": true,
   "source": "docs/ModernDocs/client-zero/ontology/seed.yaml",
   "key_path": "nodes[type=Person]",
   "format": "node keyed by the `key` fact",
   "allowed_values": [
    "^PERS-[a-z-]+$"
   ]
  },
  {
   "kind": "type",
   "id": "Persona",
   "editable": true,
   "source": "docs/ModernDocs/client-zero/ontology/seed.yaml",
   "key_path": "nodes[type=Persona]",
   "format": "node keyed by the `key` fact",
   "allowed_values": [
    "^P-\\d{2}$"
   ]
  },
  {
   "kind": "type",
   "id": "PlatformTier",
   "editable": true,
   "source": "docs/ModernDocs/client-zero/ontology/seed.yaml",
   "key_path": "nodes[type=PlatformTier]",
   "format": "node keyed by the `key` fact",
   "allowed_values": [
    "^TIER-[A-Z]+$"
   ]
  },
  {
   "kind": "type",
   "id": "PreMortem",
   "editable": true,
   "source": "docs/ModernDocs/client-zero/ontology/sample.yaml",
   "key_path": "nodes[type=PreMortem]",
   "format": "node keyed by the `key` fact",
   "allowed_values": [
    "^PM-[a-z0-9-]+$"
   ]
  },
  {
   "kind": "type",
   "id": "Process",
   "editable": true,
   "source": "docs/ModernDocs/client-zero/ontology/processes.yaml",
   "key_path": "processes[]",
   "format": "node keyed by the `key` fact",
   "allowed_values": [
    "^PROC-[a-z-]+$"
   ]
  },
  {
   "kind": "type",
   "id": "ProcessStep",
   "editable": true,
   "source": "docs/ModernDocs/client-zero/ontology/processes.yaml",
   "key_path": "processes[].steps[]",
   "format": "node keyed by the `key` fact",
   "allowed_values": [
    "^STEP-[a-z-]+-[a-z-]+$"
   ]
  },
  {
   "kind": "type",
   "id": "Product",
   "editable": true,
   "source": "docs/ModernDocs/client-zero/ontology/seed.yaml",
   "key_path": "nodes[type=Product]",
   "format": "node keyed by the `key` fact",
   "allowed_values": [
    "^PROD-[A-Z]+$"
   ]
  },
  {
   "kind": "type",
   "id": "Record",
   "editable": false,
   "source": "docs/ModernDocs/**/*.md",
   "key_path": "REC-<path>",
   "reason": "derived by loader",
   "fix_at": "the document itself; one Record per ModernDocs file",
   "format": "node keyed by the `key` fact",
   "allowed_values": [
    "^REC-.+$"
   ]
  },
  {
   "kind": "type",
   "id": "Release",
   "editable": true,
   "source": "docs/ModernDocs/client-zero/ontology/releases.yaml",
   "key_path": "releases[]",
   "format": "node keyed by the `key` fact",
   "allowed_values": [
    "^REL-[a-z0-9.-]+$"
   ]
  },
  {
   "kind": "type",
   "id": "Result",
   "editable": false,
   "source": "docs/ModernDocs/client-zero/marketing/evaluations/*.yaml",
   "key_path": "result",
   "reason": "written by script",